{
  "$schema": "http://json-schema.org/draft-07/schema#",
  "title": "UnicornCandidateSchema",
  "type": "object",
  "required": ["ticker", "market", "asof", "regime_gate", "momentum_score", "entry_price", "fundamentals"],
  "properties": {
    "ticker": { "type": "string" },
    "market": { "type": "string", "enum": ["EU", "US"] },
    "asof": { "type": "string", "format": "date" },
    "regime_gate": { "type": "string", "enum": ["TREND_UP", "TREND_DOWN"] },
    "momentum_score": { "type": "number", "minimum": 0, "maximum": 1 },
    "entry_price": { "type": "number", "exclusiveMinimum": 0 },
    "fundamentals": {
      "type": "object",
      "required": ["debt_to_equity", "ebitda_margin", "eps_growth_q_on_q", "free_cash_flow"],
      "properties": {
        "debt_to_equity": { "type": "number" },
        "ebitda_margin": { "type": "number" },
        "eps_growth_q_on_q": { "type": "number" },
        "free_cash_flow": { "type": "number" }
      }
    },
    "universe": { "type": "string", "enum": ["mega_cap", "unicorn"] },
    "technical": {
      "type": "object",
      "description": "Indicatori tecnici deterministici da score_generator.py (mai fabbricati: se mancanti, il ticker viene escluso a monte dal Data Parser).",
      "properties": {
        "rsi": { "type": "number" },
        "adx": { "type": "number" },
        "atr_pct": { "type": "number" },
        "mom6m": { "type": "number" },
        "sma20": { "type": "number" },
        "sma50": { "type": "number" },
        "sma200": { "type": "number" }
      }
    },
    "candlestick": {
      "type": "object",
      "description": "Pattern grafico/candlestick deterministico da patterns.py (mai fabbricato: se mancante, il ticker viene escluso a monte dal Data Parser).",
      "properties": {
        "trend": { "type": ["string", "null"] },
        "trend_strength": { "type": ["string", "null"] },
        "structure": { "type": ["string", "null"] },
        "continuation": { "type": ["string", "null"] },
        "breakout": { "type": ["string", "null"] },
        "pullback": { "type": ["boolean", "null"] },
        "rsi_divergence": { "type": ["string", "null"] },
        "bollinger": { "type": ["string", "null"] },
        "notes": { "type": "string" }
      }
    }
  },
  "additionalProperties": true
}
