[
  {
    "ticker": "AMAT",
    "market": "US",
    "asof": "2026-07-01",
    "regime_gate": "TREND_UP",
    "momentum_score": 0.793,
    "entry_price": 723.0,
    "fundamentals": {
      "debt_to_equity": 0.68,
      "ebitda_margin": 0.28593577728776187,
      "eps_growth_q_on_q": 0.0058,
      "free_cash_flow": 7993000000.0
    }
  },
  {
    "ticker": "GOOGL",
    "market": "US",
    "asof": "2026-07-01",
    "regime_gate": "TREND_UP",
    "momentum_score": 0.547,
    "entry_price": 357.37,
    "fundamentals": {
      "debt_to_equity": 0.47,
      "ebitda_margin": 0.38399779824471175,
      "eps_growth_q_on_q": 0.3445,
      "free_cash_flow": 174353000000.0
    }
  },
  {
    "ticker": "LIN",
    "market": "US",
    "asof": "2026-07-01",
    "regime_gate": "TREND_UP",
    "momentum_score": 0.344,
    "entry_price": 518.94,
    "fundamentals": {
      "debt_to_equity": 1.2,
      "ebitda_margin": 0.2648391285528784,
      "eps_growth_q_on_q": 0.0727,
      "free_cash_flow": 10429000000.0
    }
  },
  {
    "ticker": "UNH",
    "market": "US",
    "asof": "2026-07-01",
    "regime_gate": "TREND_UP",
    "momentum_score": 0.272,
    "entry_price": 415.63,
    "fundamentals": {
      "debt_to_equity": 6.28,
      "ebitda_margin": 0.041882267134817096,
      "eps_growth_q_on_q": -0.147,
      "free_cash_flow": 23153000000.0
    }
  },
  {
    "ticker": "GE",
    "market": "US",
    "asof": "2026-07-01",
    "regime_gate": "TREND_UP",
    "momentum_score": 0.198,
    "entry_price": 373.73,
    "fundamentals": {
      "debt_to_equity": 6.1,
      "ebitda_margin": 1.1216722340317846,
      "eps_growth_q_on_q": 0.3589,
      "free_cash_flow": 8851000000.0
    }
  },
  {
    "ticker": "AAPL",
    "market": "US",
    "asof": "2026-07-01",
    "regime_gate": "TREND_UP",
    "momentum_score": 0.197,
    "entry_price": 289.36,
    "fundamentals": {
      "debt_to_equity": 2.48,
      "ebitda_margin": 0.32643396050876966,
      "eps_growth_q_on_q": 0.227,
      "free_cash_flow": 140222000000.0
    }
  },
  {
    "ticker": "JPM",
    "market": "US",
    "asof": "2026-07-01",
    "regime_gate": "TREND_UP",
    "momentum_score": 0.19,
    "entry_price": 327.33,
    "fundamentals": {
      "debt_to_equity": 12.46,
      "ebitda_margin": NaN,
      "eps_growth_q_on_q": 0.0137,
      "free_cash_flow": -107704000000.0
    }
  },
  {
    "ticker": "TXN",
    "market": "US",
    "asof": "2026-07-01",
    "regime_gate": "TREND_UP",
    "momentum_score": 0.132,
    "entry_price": 298.07,
    "fundamentals": {
      "debt_to_equity": 1.05,
      "ebitda_margin": 0.35291246339082327,
      "eps_growth_q_on_q": 0.0481,
      "free_cash_flow": 7824000000.0
    }
  },
  {
    "ticker": "CSCO",
    "market": "US",
    "asof": "2026-07-01",
    "regime_gate": "TREND_UP",
    "momentum_score": 0.131,
    "entry_price": 117.46,
    "fundamentals": {
      "debt_to_equity": 1.57,
      "ebitda_margin": 0.23361208968491753,
      "eps_growth_q_on_q": 0.0039,
      "free_cash_flow": 13025000000.0
    }
  },
  {
    "ticker": "QCOM",
    "market": "US",
    "asof": "2026-07-01",
    "regime_gate": "TREND_UP",
    "momentum_score": 0.125,
    "entry_price": 184.79,
    "fundamentals": {
      "debt_to_equity": 6.08,
      "ebitda_margin": 0.25527132131457086,
      "eps_growth_q_on_q": -0.4415,
      "free_cash_flow": 14285000000.0
    }
  }
]